{
  "schema": 3,
  "abi": 1,
  "platforms": [
    "linux-arm64"
  ],
  "requests": {
    "26.10.6.1": {
      "linux-arm64": {
        "version": "26.10.6.1",
        "build": "20261010.000007",
        "manifest": "sha256:0b574e1fcf6c4c8e274c6bf76406a916b2cbd0b53cd59a667e662fac882298bb",
        "layer": "sha256:b6c2b8181b66c1b5895742db77ed769f563f524c1df076aa0d8f8c7600b52512",
        "bundle": "sha256:89f87e2749312fe78b79e0077710722f367cf6fd4515ffe60b770f80b1453898"
      }
    }
  }
}
