{
  "schema": 3,
  "abi": 1,
  "platforms": [
    "linux-arm64"
  ],
  "requests": {
    "26.10.7.1": {
      "linux-arm64": {
        "version": "26.10.7.1",
        "build": "20261010.000008",
        "manifest": "sha256:b039c7ea74c86078fcf4c5f7eedaa9f597194a4b18745c7f90057eb212bd26c8",
        "layer": "sha256:fb22d4a5d6761eec80f4ebd42e9f2c72094cc6bdde1d3f5c8329a4c1bfdfb9fc",
        "bundle": "sha256:aa2fb1c73b839d0e0b9533b655746dfd4e6f2494c2a770bdc0b60d21b750da7e"
      }
    }
  }
}
