{
  "schema": 3,
  "abi": 1,
  "platforms": [
    "linux-arm64"
  ],
  "requests": {
    "26.10.4": {
      "linux-arm64": {
        "version": "26.10.4.2",
        "build": "20261010.000005",
        "manifest": "sha256:a8a00148e1fb38c7504c2df4d1916e2f4a75211bc55de1e9d745f927717d4553",
        "layer": "sha256:378603f2c2a0d40c06021c8eb652b3e8d9c90261a27cc9cd7a0d16caa88579d0",
        "bundle": "sha256:de6ecdd698239dc4a874c35c4817a3775c68c8624183bbb9c7e62257156ed68f"
      }
    }
  }
}
